
mysql> create database db;
Query OK, 1 row affected (0.05 sec)

mysql> use db;
Database changed
mysql> create table employee(eid int,ename varchar(10),esal double(10,2) ,eage int,ejob varchar(10),dept_id int);
Query OK, 0 rows affected, 1 warning (0.03 sec)

mysql> desc employee;
+---------+--------------+------+-----+---------+-------+
| Field   | Type         | Null | Key | Default | Extra |
+---------+--------------+------+-----+---------+-------+
| eid     | int          | YES  |     | NULL    |       |
| ename   | varchar(10)  | YES  |     | NULL    |       |
| esal    | double(10,2) | YES  |     | NULL    |       |
| eage    | int          | YES  |     | NULL    |       |
| ejob    | varchar(10)  | YES  |     | NULL    |       |
| dept_id | int          | YES  |     | NULL    |       |
+---------+--------------+------+-----+---------+-------+
6 rows in set (0.01 sec)

mysql> alter table employee modify column eid int primary key;
Query OK, 0 rows affected (0.04 sec)
Records: 0  Duplicates: 0  Warnings: 0

mysql> desc employee;
+---------+--------------+------+-----+---------+-------+
| Field   | Type         | Null | Key | Default | Extra |
+---------+--------------+------+-----+---------+-------+
| eid     | int          | NO   | PRI | NULL    |       |
| ename   | varchar(10)  | YES  |     | NULL    |       |
| esal    | double(10,2) | YES  |     | NULL    |       |
| eage    | int          | YES  |     | NULL    |       |
| ejob    | varchar(10)  | YES  |     | NULL    |       |
| dept_id | int          | YES  |     | NULL    |       |
+---------+--------------+------+-----+---------+-------+
6 rows in set (0.00 sec)

mysql> insert into employee values(1,'ravi',1000,18,'Manager',1);
Query OK, 1 row affected (0.05 sec)

mysql> insert into employee values(2,'ram',1500,20,'Developer',2);
Query OK, 1 row affected (0.04 sec)

mysql> insert into employee values(3,'abhi',2500,22,'Marketing',3);
Query OK, 1 row affected (0.04 sec)

mysql> insert into employee values(4,'mahesh',3500,25,'Manager',1);
Query OK, 1 row affected (0.00 sec)

mysql> insert into employee values(5,'sai',4500,20,'Developer',2);
Query OK, 1 row affected (0.01 sec)

mysql> select * from employee;
+-----+--------+---------+------+-----------+---------+
| eid | ename  | esal    | eage | ejob      | dept_id |
+-----+--------+---------+------+-----------+---------+
|   1 | ravi   | 1000.00 |   18 | Manager   |       1 |
|   2 | ram    | 1500.00 |   20 | Developer |       2 |
|   3 | abhi   | 2500.00 |   22 | Marketing |       3 |
|   4 | mahesh | 3500.00 |   25 | Manager   |       1 |
|   5 | sai    | 4500.00 |   20 | Developer |       2 |
+-----+--------+---------+------+-----------+---------+
5 rows in set (0.00 sec)

mysql> ALTER USER 'root'@'localhost' IDENTIFIED WITH mysql_native_password BY 'admin';
Query OK, 0 rows affected (0.05 sec)


//updates using JDBC connectivity

mysql> select * from employee;
+-----+--------+---------+------+-----------+---------+
| eid | ename  | esal    | eage | ejob      | dept_id |
+-----+--------+---------+------+-----------+---------+
|   1 | ravi   | 1000.00 |   18 | Manager   |       1 |
|   2 | ram    | 1500.00 |   20 | Developer |       2 |
|   3 | abhi   | 2500.00 |   22 | Marketing |       3 |
|   4 | mahesh | 3500.00 |   25 | Manager   |       1 |
|   5 | sai    | 4500.00 |   20 | Developer |       2 |
|   6 | gpt    | 4000.00 |   18 | solver    |       5 |
+-----+--------+---------+------+-----------+---------+
6 rows in set (0.00 sec)

mysql> select * from employee;
+-----+--------+---------+------+-----------+---------+
| eid | ename  | esal    | eage | ejob      | dept_id |
+-----+--------+---------+------+-----------+---------+
|   1 | ravi   | 1000.00 |   18 | Manager   |       1 |
|   2 | ram    | 1500.00 |   20 | Developer |       2 |
|   3 | abhi   | 2500.00 |   22 | Marketing |       3 |
|   4 | mahesh | 3500.00 |   25 | Manager   |       1 |
|   5 | sai    | 4500.00 |   20 | Developer |       2 |
|   6 | gpt    | 4000.00 |   18 | solver    |       5 |
+-----+--------+---------+------+-----------+---------+
6 rows in set (0.00 sec)

mysql> select * from employee;
+-----+--------+---------+------+-----------+---------+
| eid | ename  | esal    | eage | ejob      | dept_id |
+-----+--------+---------+------+-----------+---------+
|   1 | ravi   | 1000.00 |   18 | Manager   |       1 |
|   2 | ram    | 1500.00 |   20 | Developer |       2 |
|   3 | abhi   | 2500.00 |   22 | Marketing |       3 |
|   4 | mahesh | 3500.00 |   25 | Manager   |       1 |
|   5 | sai    | 4500.00 |   20 | Developer |       2 |
|   6 | gpt    | 5000.00 |   18 | solver    |       5 |
+-----+--------+---------+------+-----------+---------+
6 rows in set (0.00 sec)


mysql> update employee set ejob='psolver' where eid=6;
Query OK, 1 row affected (0.05 sec)
Rows matched: 1  Changed: 1  Warnings: 0

mysql> select * from employee;
+-----+--------+---------+------+-----------+---------+
| eid | ename  | esal    | eage | ejob      | dept_id |
+-----+--------+---------+------+-----------+---------+
|   1 | ravi   | 1000.00 |   18 | Manager   |       1 |
|   2 | ram    | 1500.00 |   20 | Developer |       2 |
|   3 | abhi   | 2500.00 |   22 | Marketing |       3 |
|   4 | mahesh | 3500.00 |   25 | Manager   |       1 |
|   5 | sai    | 4500.00 |   20 | Developer |       2 |
|   6 | gpt    | 5000.00 |   18 | psolver   |       5 |
+-----+--------+---------+------+-----------+---------+
6 rows in set (0.00 sec)

mysql> select * from employee;
+-----+-------+---------+------+-----------+---------+
| eid | ename | esal    | eage | ejob      | dept_id |
+-----+-------+---------+------+-----------+---------+
|   1 | ravi  | 1000.00 |   18 | Manager   |       1 |
|   2 | ram   | 1500.00 |   20 | Developer |       2 |
|   3 | abhi  | 2500.00 |   22 | Marketing |       3 |
|   5 | sai   | 4500.00 |   20 | Developer |       2 |
|   6 | gpt   | 5000.00 |   18 | psolver   |       5 |
+-----+-------+---------+------+-----------+---------+
5 rows in set (0.00 sec)
